<?xml version="1.0" encoding="UTF-8" standalone="no"?>
<p:Carte xmlns:p="http://integrateur/carte" xmlns:xsi="http://www.w3.org/2001/XMLSchema-instance" xsi:schemaLocation="http://integrateur/carte platsSchema.xsd">
    <p:Plats>
        <p:idPlat>1</p:idPlat>
        <p:nomPlat>Cassoulet</p:nomPlat>
        <p:type>Entree</p:type>
        <p:prix>10.0</p:prix>
        <p:photo/>
        <p:ingredients>
            <p:ingredient>Haricot</p:ingredient>
            <p:ingredient>saucisse</p:ingredient>
        </p:ingredients>
    </p:Plats>
    <p:Plats>
        <p:idPlat>2</p:idPlat>
        <p:nomPlat>Creme chantilly</p:nomPlat>
        <p:type>Dessert</p:type>
        <p:prix>5.0</p:prix>
        <p:photo/>
        <p:ingredients>
            <p:ingredient>Creme fouettee</p:ingredient>
            <p:ingredient>sucre</p:ingredient>
        </p:ingredients>
    </p:Plats>
    <p:Plats>
        <p:idPlat>3</p:idPlat>
        <p:nomPlat>Mon plat</p:nomPlat>
        <p:type>Boisson</p:type>
        <p:prix>10.0</p:prix>
        <p:photo>chemin image</p:photo>
        <p:ingredients>
            <p:ingredient>Ing 1</p:ingredient>
            <p:ingredient>Ing 2</p:ingredient>
            <p:ingredient>Ing 3</p:ingredient>
            <p:ingredient>Ing 4</p:ingredient>
        </p:ingredients>
    </p:Plats>
    <p:Plats>
        <p:idPlat>4</p:idPlat>
        <p:nomPlat>Mon plat</p:nomPlat>
        <p:type>Plat</p:type>
        <p:prix>10.0</p:prix>
        <p:photo>chemin image</p:photo>
        <p:ingredients>
            <p:ingredient>Ing 1</p:ingredient>
            <p:ingredient>Ing 2</p:ingredient>
            <p:ingredient>Ing 3</p:ingredient>
            <p:ingredient>Ing 4</p:ingredient>
        </p:ingredients>
    </p:Plats>
    <p:Menus>
        <p:Menu>
            <p:idMenu>150</p:idMenu>
            <p:listePlat>
                <p:idPlat>1</p:idPlat>
                <p:idPlat>2</p:idPlat>
                <p:idPlat>3</p:idPlat>
                <p:idPlat>4</p:idPlat>
            </p:listePlat>
            <p:listeGenre>
                <p:genre>Amour</p:genre>
                <p:genre>Policier</p:genre>
                <p:genre>Science fiction</p:genre>
            </p:listeGenre>
        </p:Menu>
    </p:Menus>
</p:Carte>
